[
  {
    "id": "race:elf",
    "name": "Elf",
    "description": "Elves are a magical people of otherworldly grace, living in the world but not entirely part of it. They live in places of ethereal beauty, in the midst of ancient forests or in silvery spires glittering with faerie light.",
    "size": "Medium",
    "speed": 30,
    "creature_type": "Humanoid",
    "vision_type": "Darkvision",
    "vision_range": 60,
    "requires_sleep": false,
    "rest_duration": 4,
    "rest_type": "trance",
    "ability_score_increases": {
      "Strength": 0,
      "Dexterity": 2,
      "Constitution": 0,
      "Intelligence": 0,
      "Wisdom": 0,
      "Charisma": 0
    },
    "source": "phb",
    "ruleset": "dnd5e",
    "base_race": null,
    "subraces": ["High Elf", "Wood Elf", "Drow"],
    "traits": [
      {
        "name": "Keen Senses",
        "description": "You have proficiency in the Perception skill.",
        "mechanics": [
          {
            "type": "proficiency",
            "category": "skill",
            "proficiencies": ["Perception"]
          }
        ],
        "id": "trait:elf-keen-senses"
      },
      {
        "name": "Fey Ancestry",
        "description": "You have advantage on saving throws against being charmed, and magic can't put you to sleep.",
        "mechanics": [
          {
            "type": "passive",
            "effects": [
              {
                "advantage": {
                  "saving_throw": ["Strength", "Dexterity", "Constitution", "Intelligence", "Wisdom", "Charisma"],
                  "against": {
                    "status": ["status:charmed"]
                  }
                }
              }
            ]
          },
          {
            "type": "passive",
            "effects": [
              {
                "immunity": {
                  "category": "status",
                  "status": ["sleep"],
                  "source": {
                    "origin": "magical"
                  }
                }
              }
            ]
          }
        ],
        "id": "trait:elf-fey-ancestry"
      }
    ],
    "languages": [
      {
        "language": "lang:common",
        "choice": false
      },
      {
        "language": "lang:elvish",
        "choice": false
      }
    ]
  },
  {
    "id": "race:high-elf",
    "name": "High Elf",
    "description": "As a high elf, you have a keen mind and a mastery of at least the basics of magic. High elves are more common in the worlds of D&D, being found in ancient forests, along the coasts, or in isolated towers where they practice their magical arts.",
    "size": "Medium",
    "speed": 30,
    "creature_type": "Humanoid",
    "vision_type": "Darkvision",
    "vision_range": 60,
    "requires_sleep": false,
    "rest_duration": 4,
    "rest_type": "trance",
    "ability_score_increases": {
      "Strength": 0,
      "Dexterity": 2,
      "Constitution": 0,
      "Intelligence": 1,
      "Wisdom": 0,
      "Charisma": 0
    },
    "source": "phb",
    "ruleset": "dnd5e",
    "base_race": "race:elf",
    "traits": [
      {
        "name": "Elf Weapon Training",
        "description": "You have proficiency with the longsword, shortsword, Shortbow, and Longbow.",
        "mechanics": [
          {
            "type": "proficiency",
            "category": "weapon",
            "proficiencies": ["equip:longsword", "equip:shortsword", "equip:shortbow", "equip:longbow"]
          }
        ],
        "id": "trait:high-elf-elf-weapon-training"
      },
      {
        "name": "Cantrip",
        "description": "You know one cantrip of your choice from the wizard spell list. Intelligence is your spellcasting ability for it.",
        "mechanics": [
          {
            "type": "choice",
            "choice_type": "query",
            "count": 1,
            "name": "Cantrip",
            "query": {
              "source": "spells",
              "params": {
                "class": "Wizard",
                "level": 0
              }
            }
          }
        ],
        "id": "trait:high-elf-cantrip"
      },
      {
        "name": "Extra Language",
        "description": "You can read, speak, and write one additional language of your choice.",
        "mechanics": [
          {
            "type": "choice",
            "choice_type": "language",
            "count": 1
          }
        ],
        "id": "trait:high-elf-extra-language"
      }
    ],
    "languages": []
  },
  {
    "id": "race:wood-elf",
    "name": "Wood Elf",
    "description": "As a wood elf, you have keen senses and intuition, and your fleet feet carry you quickly and stealthily through your native forests. Wood elves tend to be reclusive and distrustful of non-elves.",
    "size": "Medium",
    "speed": 30,
    "creature_type": "Humanoid",
    "vision_type": "Darkvision",
    "vision_range": 60,
    "requires_sleep": false,
    "rest_duration": 4,
    "rest_type": "trance",
    "ability_score_increases": {
      "Strength": 0,
      "Dexterity": 2,
      "Constitution": 0,
      "Intelligence": 1,
      "Wisdom": 1,
      "Charisma": 0
    },
    "source": "phb",
    "ruleset": "dnd5e",
    "base_race": "race:elf",
    "traits": [
      {
        "name": "Elf Weapon Training",
        "description": "You have proficiency with the longsword, shortsword, Shortbow, and Longbow.",
        "mechanics": [
          {
            "type": "proficiency",
            "category": "weapon",
            "proficiencies": ["equip:longsword", "equip:shortsword", "equip:shortbow", "equip:longbow"]
          }
        ],
        "id": "trait:wood-elf-elf-weapon-training"
      },
      {
        "name": "Fleet of Foot",
        "description": "Your base walking speed increases to 35 feet.",
        "mechanics": [
          {
            "type": "passive",
            "effects": [
              {
                "attribute": {
                  "category": "movement",
                  "property": "base",
                  "calculation": {
                    "operation": "set",
                    "operators": [
                      {
                        "type": "integer",
                        "value": 35
                      }
                    ]
                  }
                }
              }
            ]
          }
        ],
        "id": "trait:wood-elf-fleet-of-foot"
      },
      {
        "name": "Mask of the Wild",
        "description": "You can attempt to hide even when you are only lightly obscured by foliage, heavy rain, falling snow, mist, and other natural phenomena.",
        "mechanics": [
          {
            "type": "special"
          }
        ],
        "id": "trait:wood-elf-mask-of-the-wild"
      }
    ],
    "languages": []
  },
  {
    "id": "race:drow",
    "name": "Drow",
    "description": "Descended from an earlier subrace of dark-skinned elves, the drow were banished from the surface world for following the goddess Lolth down the path to evil and corruption. Now they have built their own civilization in the depths of the Underdark.",
    "size": "Medium",
    "speed": 30,
    "creature_type": "Humanoid",
    "vision_type": "Superior Darkvision",
    "vision_range": 120,
    "requires_sleep": false,
    "rest_duration": 4,
    "rest_type": "trance",
    "ability_score_increases": {
      "Strength": 0,
      "Dexterity": 2,
      "Constitution": 0,
      "Intelligence": 0,
      "Wisdom": 0,
      "Charisma": 1
    },
    "source": "phb",
    "ruleset": "dnd5e",
    "base_race": "race:elf",
    "traits": [
      {
        "name": "Sunlight Sensitivity",
        "description": "You have disadvantage on attack rolls and on Wisdom (Perception) checks that rely on sight when you, the target of your attack, or whatever you are trying to perceive is in direct sunlight.",
        "mechanics": [
          {
            "type": "special"
          }
        ],
        "id": "trait:drow-sunlight-sensitivity"
      },
      {
        "name": "Drow Magic",
        "description": "You know the dancing lights cantrip. When you reach 3rd level, you can cast the faerie fire spell once with this trait and regain the ability to do so when you finish a long rest. When you reach 5th level, you can cast the darkness spell once with this trait and regain the ability to do so when you finish a long rest. Charisma is your spellcasting ability for these spells.",
        "mechanics": [
          {
            "type": "spellcasting",
            "spell": "spell:dancing-lights",
            "ability": "Charisma",
            "components": ["Verbal", "Somatic"]
          },
          {
            "type": "spellcasting",
            "spell": "spell:faerie-fire",
            "ability": "Charisma",
            "components": ["Verbal"],
            "uses": {
              "value": 1
            },
            "recharge": "long_rest",
            "requirements": [
              {
                "type": "level",
                "level": {
                  "minimum": 3
                }
              }
            ]
          },
          {
            "type": "spellcasting",
            "spell": "spell:darkness",
            "ability": "Charisma",
            "components": ["Verbal"],
            "uses": {
              "value": 1
            },
            "recharge": "long_rest",
            "requirements": [
              {
                "type": "level",
                "level": {
                  "minimum": 5
                }
              }
            ]
          }
        ],
        "id": "trait:drow-drow-magic"
      },
      {
        "name": "Drow Weapon Training",
        "description": "You have proficiency with rapiers, shortswords, and hand crossbows.",
        "mechanics": [
          {
            "type": "proficiency",
            "category": "weapon",
            "proficiencies": ["equip:rapier", "equip:shortsword", "equip:hand-crossbow"]
          }
        ],